Mã đơn,Khách,SĐT,Sản phẩm,Bộ phận,Ghi chú,Cập nhật
DH001,Nguyễn Thị Hồng,0905123456,Backdrop hoa cưới 3m,SALES,Khách chốt tông trắng kem,20/07/2026 09:15
DH002,Trần Văn Nam,0912987654,Cổng hoa lối đi,SẢN XUẤT,Cần xong trước 25/07,19/07/2026 14:30
DH003,Lê Minh Anh,0987456123,Bàn gallery + khung ảnh,SALES,Chờ khách xác nhận màu khăn,20/07/2026 10:00
DH004,Phạm Thu Hà,0938222111,Hoa để bàn tiệc x20,GIAO,Giao tận sảnh khách sạn Rex,18/07/2026 16:45
DH005,Võ Quốc Bảo,0909333222,Standee đón khách,SẢN XUẤT,In lại vì sai tên cô dâu,20/07/2026 08:20
